{
   "title":"כותרת",
   "author":"מחבר הפעולה",
   "language":"he",
   "direction":"rtl",
   "preface": "",
   "content":[
      {
         "type":"scouting",
         "title":"רכיב חדש",
         "preface": "",
         "content":[
            {
               "title":"מתודה 1",
               "content":"תוכן המתודה",
               "equipment":"ציוד",
               "time":1
            }
         ]
      },
      {
         "type":"content",
         "title":"רכיב חדש",
         "preface": "",
         "content":[
            {
               "title":"מתודה 1",
               "content":"תוכן המתודה",
               "equipment":"ציוד",
               "time":1
            },
            {
               "title":"מתודה 2",
               "content":"תוכן המתודה",
               "equipment":"ציוד",
               "time":1
            }
         ]
      }
   ]
}