{"title":"מעעע","author":"עומר","language":"he","direction":"rtl","preface":"","content":[{"type":"meeting","title":"","preface":"","content":[{"title":"מפק","content":"","equipment":"","time":10}]},{"type":"scouting","title":"פיתה בטאבון","preface":"","content":[{"title":"מתודה חדשה","content":"תוכן המתודה","equipment":"ציוד","time":10},{"title":"מתודה חדשה","content":"תוכן המתודה","equipment":"ציוד","time":10}]},{"type":"content","title":"רכיב חדש","preface":"","content":[{"title":"מתודה חדשה","content":"תוכן המתודה","equipment":"ציוד","time":10}]}]}