{
   "title":"פעולה 6 - אחריות לקבוצה",
   "author":"עומר שריג",
   "language":"he",
   "direction":"rtl",
   "preface": "",
   "content":[
      {
         "type":"meeting",
         "title":"",
         "preface": "",
         "content":[
            {
               "title":"זמן מפקד - מסדר",
               "content":"",
               "equipment":"",
               "time":30,
               "id":0
            }
         ],
         "id":0
      },
      {
         "type":"playing",
         "title":"",
         "preface": "",
         "content":[
            {
               "title":"כלב ועצם",
               "content":"מחלקים את האחווה לשתי קבוצות, ומעמידים אותן בשתי שורות אחת מול השנייה. לשורה אחת מחלקים אותיות ולשנייה מספרים. בין השורות מניחים חפץ כלשהו. כל פעם, המדריך קורא באות ומספר, והזוג שמתאים לאות ולמספר צריך לקחת את החפץ לצד שלו.",
               "equipment":"חפץ כלשהו",
               "time":10
            }
         ]
      },
      {
         "type":"content",
         "title":"באיזו מידה אני אחראי לקבוצה?",
         "preface": "",
         "content":[
            {
               "title":"ייצוג",
               "content":"מציגים לחניכים דמויות שלגיבורי על, או דמויות מצוירות מנהיגים וכדומה. על כל חניך לבחור את הדמות שהוא היה רוצה לגלם כחבר בקבוצה ולהסביר מדוע, כלמהר במה תוכל הדמות לתרום לקבוצה: כלומר, \"אם הקבוצה שלנו הייתה מורכבת מהדמויות האלה איזה דמות הייתי רוצה להיות\". לדוגמא - \"גיא אמר שכחלק מהקבוצה הוא היה רוצה להיות כמו TAZ כי הוא מדבר מצחיק\".\nהערות למדריך: חשוב לכוון את השאלות ואת הדיון לתכונות מהויות של גיבור העל. תכונות כמו: רוצה לעזור, אמיץ, נבון, אחראי וכו', ולקשר אותן לתרומה האפשרית לקבוצה ולאחריות הקבוצתית שיש לנו כחברי קבוצה.",
               "equipment":"",
               "time":20
            },
            {
               "title":"התבוננות",
               "content":"נדבר על הדמויות שהחניכים לא בחרו:\n* האם האיכויות של הדמויות שנשארו לא נחוצות בתוך הקבוצה?\n* האם הן קיימות כבר בקבוצה?\n* מי ממלא אות, כולנו או רק חלקנו?\nהערות למדריך: ננסה להבין איזה דמויות לא נבחרו ונשאל האם האיכויות שלהן נחוצות. אם כן מישהו צריך לקחת אחריות גם מהבחינה הזאת. למשל, אם לא נבחרה הדמות שמסמלת מנהיגות נפתח את הדיון הקבוצתי סביב הנחיצות של איכות  כזאת בקבוצה - האם זה מוטל על כל חברי הקבוצה או נחוץ שיהיה אחד שייקח אותה על עצמו.",
               "equipment":"",
               "time":10
            }
         ]
      },
      {
         "type":"playing",
         "title":"",
         "preface": "",
         "content":[
            {
               "title":"הצגה עם חורים",
               "content":"משחקים בהצגה עם חורים. בוחרים שני מתנדבים, ונותנים להם סיטואציה להמחיז. בזמן הסיטואציה הן יכולות לבקש מילה מהמדריך לשימוש בהצגה.",
               "equipment":"",
               "time":20
            }
         ]
      },
      {
         "type":"scouting",
         "title":"",
         "preface": "",
         "content":[
            {
               "title":"מיומנות צופית - כפיתה קבוצתית",
               "content":"על החניכים לכפות ביחד כפיתה אחת, כאשר לאף אחד אסור לעזוב את החבלים או הסנאדות במהלך הכפיתה. מחלקים את החניכים לשתי קבוצות: \"מחזיקים\", שיחזיקו את הסנאדות, ו\"כופתים\", שיחזיקו את החבל וילפפו. כיוון שאסור לעזוב ידיים החניכים יצטרכו לנוע מעל ומתחת לסנאדות ולעבוד בשיתוף פעולה עם חוליית \"המחזיקים\".\nגיוון: ניתן למנות מנהיג לקבוצה, לאסור על הדיבור, לקשור חלק מהחניכים ביניהם ועוד.",
               "equipment":"חבל, 2 סנאדות",
               "time":25
            }
         ]
      }
   ]
}