{
   "title":"",
   "author":"",
   "language":"he",
   "direction":"rtl",
   "preface":"",
   "content":[
      {
         "type":"scouting",
         "title":"",
         "preface":"",
         "content": [
            {
               "title":"",
               "content":"",
               "equipment":"",
               "time":10
            }
         ]
      }
   ]
}