{"title":"כותרת","author":"דוקיז ועמיזוש","language":"he","direction":"rtl","preface":"עמיזוש ודוקי עושים סוויש וכיף להם ביחד עם מיצי","content":[{"type":"content","title":"למה לעשות פעילויות תוכן מהקלסר?","preface":"","content":[{"title":"ייצוג - סולם מסכים לא מסכים","content":"אמירות על הקלסר. ראה נספח 1","equipment":"ציוד","time":10},{"title":"הבעה יצרתית - פעילות תוכן של אחווה","content":"מבקשים מכל מרכז צעיר לצייר את הפעילות תוכן המושלמת וליד זה את הפעילות תוכן הגרועה ביותר. מבקשים כל מרכז להתעקב על המאפיינים הכתובים בנפסח 2. חשוב לתת להם להציג את הציור שלהם ולהסביר למה הפעולה עובדת או לא עובדת. כותבים על הלוח את המאפיינים שעולים לפעולה","equipment":"דפים, תושים","time":15},{"title":"חשיבה משותפת - המדריך למדריך להתאמת פעילות תוכן","content":"בהתאם למה שעלה במתודה הקודמת עליכם להרכיב ביחד מסמך אותו נפיץ לשכב\"ג ובו יהיה כתוב כיצד נמנעים מהבעיות של התאמת פעילויות תוכן לקבוצות\n\n**הערות למדריך:** להיות דוקטור","equipment":"ציוד","time":10}]},{"type":"scouting","title":"","preface":"","content":[{"title":"קשר ידידות  - לקראת טקס פתיש","content":"","equipment":"","time":20}]}]}